{"event_id":"00000000-0000-4000-8000-000000000012","event_type":"modify_requested","execution_session_id":"00000000-0000-4000-8000-000000000003","intent_id":"00000000-0000-4000-8000-000000000001","internal_order_id":"00000000-0000-4000-8000-000000000201","payload":{"limit_price_paise":25005,"quantity":65,"update_id":"modify-request-1"},"schema_version":"1.0.0","strategy_id":"d51","strategy_run_id":"00000000-0000-4000-8000-000000000002","timestamp_ns":101}
